ID,title,url,company,location,description
5, Software Developer, https://ro.indeed.com/rc/clk?jk=5b960838d2a0e32d&bb=WL2FuPauXtgRj_-B89iTvIVEI0y1MsxsJC5yQQ_MMGuDT2dqXaRe5QmVxG-JFsPA7GXSacx9WjpbajNaK0YUuIt6_AnrdJSZGBEwe4ETmF7NFiG7bgyrwXi6Omc5xUmZ&xkcb=SoBH67M3-ak2PxRUip0ObzkdCdPP&fccid=774af43277ae7ad5&vjs=3, Systematic, București," software developer for the library&learning team

would you like to contribute to developing/delivering integrated, innovative library solutions, using and adapting the systematic development process to ensure highest quality of our products?

the project

we are looking for a software developer highly motivated and ready to contribute to bringing libraries and educational institutions to the next level of digital capabilities as part of a large distributed team consisting of developers, architects, user experience designers, testers and project managers!

systematic in romania is a rapidly growing company, where you will find an open-minded working environment, with strong focus on our employees and their wellbeing. in systematic you have the opportunity to both contribute with your experience and further develop your skills.

in the beginning of the employment, please expect to travel to denmark for approximately 2 weeks. the stay in aarhus is required to attend an onboarding course and to be acquainted with the company, culture, the project, and the team.

here is a taste of what you will be doing

as a software developer in the library&learning team, you will work with our colleagues in bucharest and denmark on existing code as well as developing brand-new features:

understand the user and his world, translating knowledge of users in the solution
estimate individual tasks, features and projects throughout
write high quality code
implement unit- and integration test for features based on the test design
test to an appropriate extent, deploying automatically test when possible
write documentation and work with process development
troubleshoot and debugg

our ideal candidate would:

have at least 2 years of experience in software development
have a preference for agile environments and previous experience with scrum/ kanban
possess a great drive and commitment, have a positive approach to things and demonstrate good communication skills
like to be an integral part of a team, demonstrating willingness to share knowledge and work closely with others
be quality oriented, and work together with the team to test and secure high quality
be proactive, responsible, result oriented, and appreciate a autonomy in organizing own work
last but not least, we are looking for a strong team player, who is aware of own strengths and weaknesses and thrives on close co-operation with the team and colleagues across the organisation. we succeed as a team and we fail as a team!

requierd expertise

solid knowledge of at least 1 programming language (e.g. java, typescript) and quickly assimilating new programming languages
previous experience with modern frontend technologies/frameworks (e.g. angular, react, javafx, html, css/scss, ecma 6, angularjs, vuejs)
programming experience using java platform (i.e. java se 8+, java ee 8+)
hands-on experience with ci/cd tools (preferably teamcity)
specific working experience with code repositories (preferably bitbucket/git), with java ide (preferably intellij idea), and with collaboration tools/ applications (preferably, but not limited to atlassian stack – confluence, jira)
working knowledge on databases (e.g., microsoft sql server, postgresql)
automated testing (preferably junit 5+, mockito, assertj, jasmine/karma)
strong command of the english language, both speaking and writing
it would be considered an advantage if you have experience with:

keycloak
microservices
reactive programming (rxjs)
state management (i.e. ngrx, rxjs)
docker, docker compose, kubernetes
elasticsearch
kafka
solr
shell scripting (e.g. bash)
integration testing (e.g. playwright)
what we offer:

at systematic, we focus on both personal and professional growth within a stable and innovative work environment that prioritizes employee well-being
up to 23 vacation days, 21 days standard to which 2 more days can be added if you have more than 10 years of work experience.
24h (3 days) extra per year for personal time off for all employees.
access to wellness and well-being services through dedicated platforms
we foster a sense of community and connection through a range of events, including out-of-office gatherings with your colleagues and access to systematic's tech events and corporate activities during office hours.
enjoy daily fresh meals, fruits, pastries, and beverages in our canteen and delightful terrace.
a flexible benefits program - you can mix your benefits by choosing from different kind of services on a very dynamic platform – benefit online, such as:
private medical subscription - you can choose from 3 providers
private pension
meal or vacation vouchers
gym subscription.
practical information

hybrid setup: office and remote work
our team is based in romania and denmark, with collaboration and occasional travel between the two locations, so you should expect 2-4 weeks of travel per year.
please note that you must be able to present a clean criminal record and have lived in a nato/eu country for the past seven years as we work with security-classified projects. read more here.
we will be assessing applications on an ongoing basis as we wish to fill the position as soon as possible.
if you have any questions, you are always welcome to contact andra antochi, talent acquisition consultant (andra.maria.antochi@systematic.com) for more information about the position.
read more about our recruitment process and what we value in a cv and cover letter here: https://systematic.com/en-gb/careers/how-to-apply/
get in touch
andra antochi
talent acquisition consultant

location: bucharest, ro
division: l&l operations & sales
get to know us
career in systematic
recruitment process
more than software
our business"
6, Junior Java Developer, https://ro.indeed.com/rc/clk?jk=57168e64858b0660&bb=WL2FuPauXtgRj_-B89iTvAU8yTnMl7mMgoRw-pMDSoBqgnZFkENm09rMppsW-32SahEn1T_Rthw3jwHcCsrSpGraDJ0dHPXQkmyKNghEgwh2winoq4AFKp07VZ7bLvFz&xkcb=SoDa67M3-ak2PxRUip0NbzkdCdPP&fccid=7de96d41156df8d1&vjs=3, E-dea Works, București," job description
develop and customize the software according to client requirements.
software project support and maintenance.
identify and resolve client concerns
working with us
active and challenging environment.
learn new technologies.
skill development.
improve your english skills.
friendly environment to work in.
flexible working hours.
benefits
salary is reviewed 2 times a year based on employee’s performance .
bonus based on staff performance.
company trip once a year.
private health insurance.
daily meal at excellent price
build a stable career with dynamic promotion and job opportunities.
requirements
student or bachelor’s degree in computer science or related field.
know to program in java
knowledge about database queries (mysql, oracle, postgres)
good analytical skills
considered a plus
experience with various code versioning systems, such as subversion
knowledge of german language"
7," Software Engineer, Angular Web Developer", https://ro.indeed.com/rc/clk?jk=fdd510b17b35ecbd&bb=WL2FuPauXtgRj_-B89iTvGHNL1ZfQwKSjJ9x1uhnlm7ViOgychi05kbkuOWBUsGfHUfVUZSZtj3MCxhK-xTE2ZV-oBraTUO7gLuEQA0EtSaRXN-EuDC8GNi8Mpavdh73&xkcb=SoBu67M3-ak2PxRUip0MbzkdCdPP&fccid=2d0740e02e80cf22&vjs=3, Airbus Defence and Space Romania SRL, București," job description:
software engineer, angular web developer
airbus defense and space is one of the three divisions of the airbus group and europe’s number 1 defense and space company. it is the world’s second largest space company and one of the top 10 defense companies globally. airbus defense and space develops and engineers cutting-edge and peerlessly reliable products in the field of defense and space. its defense and space technologies enable governments and institutions to protect natural resources, societies and individual freedom.
www.airbusdefenceandspace.com
interest group:
software engineer, frontend developer
contract type/working time:
permanent
work experience:
min 5 years
we are looking for a software engineer, angular web developer to become part of the airbus defence and space romania team.
responsibilities :
design and development of core application modules
maintain project technical infrastructure (ci/cd)
task decomposition and estimation
bug fixing, test writing
peer review, mentoring
contribute to existing documentation and debug/track/ resolve issues by analyzing the sources of issues and implementing solutions
requirements :
experienced in angular framework, angularjs, redux and graphql technologies
experienced with data-structures and algorithms
experience with front-end frameworks, full-stack development and/or api development
good understanding in software design patterns
write tests and are familiar with ci/cd tools
nice to have:
experience in typescript, css, html
experience with version control systems, git
familiar with virtualization tools like docker and cluster technologies like k8s
familiar with agile methodology and with tools like jira, confluence
familiar with other programming languages like react, java, python
experience in other web frontend technologies would be considered a plus
what’s in it for you?
a great place to develop your career
exciting and meaningful projects
continuous education and training
attractive compensation package
performance related bonus
this job requires an awareness of any potential compliance risks and a commitment to act with integrity, as the foundation for the company’s success, reputation and sustainable growth.
company:
airbus defence and space romania srl
employment type:
permanent
-
experience level:
professional
job family:
software engineering <jf-en-ek>
by submitting your cv or application you are consenting to airbus using and storing information about you for monitoring purposes relating to your application or future employment. this information will only be used by airbus.
airbus is committed to achieving workforce diversity and creating an inclusive working environment. we welcome all applications irrespective of social and cultural background, age, gender, disability, sexual orientation or religious belief.
airbus is, and always has been, committed to equal opportunities for all. as such, we will never ask for any type of monetary exchange in the frame of a recruitment process. any impersonation of airbus to do so should be reported to emsom@airbus.com .
at airbus, we support you to work, connect and collaborate more easily and flexibly. wherever possible, we foster flexible working arrangements to stimulate innovative thinking."
8," Software Developer, Backend", https://ro.indeed.com/rc/clk?jk=898b5e6916edb02d&bb=WL2FuPauXtgRj_-B89iTvKKJARVW9r92QRpSCIPfVGHEOgIyHr4gGgNGaAkQHgrExObIMMIoZFdGEeHBqsYGlPLfUkVUpIKzuY004fQ_dSNbudvvVSHh9mL4JMNIuMkq&xkcb=SoCH67M3-ak2PxRUip0DbzkdCdPP&fccid=cc35cdc10c90c921&vjs=3, Hootsuite, București," we're looking for a software developer who can design, build, test, and ship high quality software that delivers value to our customers. you'll work on a small and agile team that continuously incorporates feedback to refine and improve the products and features you deliver. your team will own the entire delivery lifecycle from beta releases to production ready, scalable products suitable for new and existing customers. while working in a hybrid work arrangement, a blend of virtual (in accordance with hootsuite's distributed workforce strategy), and in hootsuite's rome, milan, or bucharest office, you will report to manager, software development.

what you'll do:
work within a cross-functional team (including designers, product managers, architects and other developers) to deliver compelling products and services to our customers
design, write, test, and deploy high quality scalable code
implement our technical roadmap as we scale our services and build new products
maintain standards of security, reliability, performance, and quality
work out loud by sharing your experiences and expertise, helping to improve and enhance processes
take ownership of your work and work autonomously when necessary
participate in code reviews, and apply software development best practices
write production code for our search and analytics engine running on more than 1000 servers, and processing petabytes of data each day. we currently index multiple million unique new posts per day. our search archive has over 1 pb of data and we add each day over 1 tb of new data.
work with the following technologies: mainly with java, elasticsearch, docker, jenkins, kafka, cassandra, domain driven design, event sourcing, test driven design and agile

what you'll need:
a degree in computer science or engineering, and some practical or relevant experience in developing and maintaining software or an equivalent level of education or work experience, and a track record of substantial contributions to software projects with high business impact
you are proficient in java or a similar language and have a desire to learn other languages
you have a deep understanding of language dependent search, statistics, ranking, categorization, faceted search, live updates of metadata, complex query analysers, query plan optimisation and caching.
you understand distributed systems and how to work in clustered high throughput / high availability environments
you have experience in software design: you know how to analyze and design features, drive discussions, and propose technical solutions.
you have been a solid contributor in teams that have worked on medium-to-large sized projects that had an impact on business; an understanding of saas software development practice is considered an asset.
you know how to apply best practices to ensure high-quality code (i.e. automated tests; code reviews).
open communication: clearly conveys thoughts, both written and verbally, listening attentively and asking questions for clarification and understanding
collaboration and teamwork: works with others to deliver results, meaningfully contributing to the team and prioritizing group needs over individual needs
self development: is personally committed to, and actively works to continuously improve
problem solving: uses an organized and logical approach to find solutions to complex problems and looks beyond the obvious to understand the root cause of problems and proposes several possible solutions
resilience, tolerance for change/ambiguity: can effectively cope with change, finding ways to advance work and projects

who you are:
tenacious. you are determined to succeed, and you are motivated by the success of customers, colleagues and the community.
curious. you are always learning and seeking ways to make things better.
conscientious. you keep your promises, taking your commitments to others seriously, and you have strong integrity.
humble. you lead with humility and empathy, respecting and learning from the perspectives of others.
accommodations will be provided as requested by candidates taking part in all aspects of the selection process.

#li-zt1"
9, C# Software Developer, https://ro.indeed.com/rc/clk?jk=85d61ed076059c1d&bb=WL2FuPauXtgRj_-B89iTvOlUFnapvGVb59kvh5o5LRyvaRv5l6zpbJEE-Vn8QpCPNkuKLplaAwB1f2hmT0eH4zRiY_nf-2OcodDx3d1pYrBLp1SBYjQu4ln0qlRxT5u3&xkcb=SoAz67M3-ak2PxRUip0CbzkdCdPP&fccid=62aaa121d3b74282&vjs=3, Applied Software Technology, București," romania
bucuresti
r&d
regular full-time
1627

job description
about graitec group

graitec group company is a global software editor leading building information modeling (bim) solutions and helping its architectural, engineering, construction, and manufacturing customers to digitize and industrialize their processes to improve performance and build a sustainable tomorrow.

ambitious and fast-growing environment: we see ourselves as a 30 years old startup, having doubled our revenue in the last 3 years again thanks to both organic and inorganic growth and targeting 500m€ revenue in 2024 (join us to make it happen!).
we strongly believe that this growth will continue since the market is only at the beginning of its digitization.
experts & talents with strong culture: our team is made of more than 700 outstanding talents with a strong management team to execute our mission.
a true international group: graitec serves more than 200 000 customers worldwide with +50 offices in 13 different countries, enabling us to meet our customer needs around the globe
a market leader: we are one of the largest autodesk platinum partners and the only one operating at worldwide scale with an equal split of the business between europe and north america, enabling autodesk solutions thanks to our own graitec softwares
strong products serving the construction & manufacturing industries: through autodesk products add-ons like powerpack to more complex solutions to enable simulation, fabrication & management of our customers projects, graitec is proud of its 150+ developers innovating each day to accelerate our customers performance.

we are driven to hire the best people, with diverse experiences, and provide them with the resources that empower them to achieve their full potential. this ultimately enables our organization to provide the very best customer experience and solutions that help our customers navigate and implement technologies and services that prepare them for sustainable growth.


about the team hiring

as a manufacturer of high-performance bim applications, graitec focuses its energy in becoming a truly international design, simulation, fabrication and data management software developer for the construction industry around the world.
the r&d division of graitec is a diverse, multicultural environment, with a wide range of experienced professionals, with strong technical / interpersonal skills and a dedication to excellence. cantered in romania, the r&d team also operates locally, in france, uk, canada, czech republic, germany and poland, working alongside the product management team in offering top-notch solutions to the aec sector.
we offer a rewarding working environment, together with comprehensive and ongoing learning, where personal initiative and development are encouraged and the freedom in implementing ideas that people consider beneficial for the company’s activity.


overview

role purpose/objective
software developers are responsible for writing and implementing efficient code for new or existing software inside graitec product portfolio: researching, designing, implementing, and managing software programs, testing and evaluating, identifying areas for modification in existing programs and developing these modifications.

key responsibilities development:
has a global understanding of the architecture of allocated applications
ensure clear and structured programming, keeping performance, maintenance and compatibility requirements in mind
develops software programs, modules, and algorithms for projects, following the specific requirements and company guidelines;
designs, implements and modifies the structure of the databases necessary to achieve the required implementations;
is preoccupied with ensuring the best possible quality of implementations;
maintains existing programs by making changes following requirements;
configures the applications necessary to carry out the activity;
writes specifications for the development of computer programs and describes the architecture of the developed component;
submits technical reports for developments or for other topics of interest for ongoing projects;
makes proposals for software research and development topics. testing · creates automatic tests for the carried-out implementations;
tests the carried-out implementations/modifications;
documents the source code;
meets programming, documentation, and testing standards and conventions;
promptly solves the problems that arise in the area of competence;

key metrics:
delivery of development on time as expected by manager
minimal return rate from testing team on your development that translate into high quality production
bugs tracked and fixed in timely manner for allocated development
complete 2 trainings per year as defined in developers’ roadmap

responsibilities

mandatory experience:
2+ years of relevant experience as a software developer
proficiency in c# with a fair knowledge of the language specification.
experience in object-oriented programming (oop): encapsulation, inheritance, polymorphism, templates.
experience with microsoft sql server, mysql or oracle databases
experience in agile team setup, e.g. scrum and/or kanban
reading and interpreting pre-existing code
experience of applying automation tools for building software, testing, and deployment
proven experience of the software development lifecycle in a commercial environment.
a track record of delivering complex technical solutions to production use
nice to have:
experience with source control systems, such as git or svn
previous experience with cloud technologies, (private or public)
infrastructure and devops tools knowledge: azure devops, git, ci/cd etc

qualifications
bachelor’s degree/student in computer science, computer engineering or equivalent
fluency in english (spoken/written);
organized with the ability to prioritize own workload and adhere to deadlines.
ability to work as part of a team with good communication skills
strong troubleshooting and problem-solving skills
attention to details
self-taught, pro-active and self-motivated
ability to share their knowledge

interview process

we are looking for talents that will enjoy, live and accelerate our culture and values.

at graitec, we work together locally & globally with an entrepreneurial mindset.
as entrepreneurs, we are focused on achieving our vision and do not easily get distracted along the way. we believe in our products
and services and that we are on a path to solve a real problem for our target customers & the overall industry. we are thoughtful on
our investments and lead ethically to maximize the company opportunity. to better understand them, we want to represent the
diversity of our customers around the globe & we are breaking our own siloes to better serve them.

to make this culture a reality, we rally our teams around shared cultural attributes we expect the full team to role model in order to realize our mission: · the way we work: growth, agility, innovation and responsibility · the way we behave: ambition, engagement, one graitec, positive energy at graitec, we’re proud to be committed to diversity and inclusion in the workplace. we value our employees for the individuals they are and the contributions they can bring to our teams by bringing their authentic self at work. this resonates with the large variety of customers & markets we operate in, and is part of our success story. as such, we welcome applications from all backgrounds and will not make any assessment into the application process other than candidates’ skills and capabilities to succeed in role.

interview process:
screening/get to know discussion
technical assessment
peer of hiring manager or key stakeholder to the role from another organization"
11, Junior Php Developer, https://ro.indeed.com/rc/clk?jk=8cb033ec2a994de4&bb=WL2FuPauXtgRj_-B89iTvPi-B9x1uxNqmVN4uhOAq19Uk9BqNqxAW88iuaaqbXiZ8G-QAdJhqv3qefnToP8yjA8mMVePRFF8BQFGRVLVOKf9ar_lmrMxypHcwUnoXjog&xkcb=SoAa67M3-ak2PxRUip0AbzkdCdPP&fccid=7de96d41156df8d1&vjs=3, E-dea Works, București," job description
develop and customize php software according to client requirements.
software project support and maintenance.
identify and resolve client concerns
work with zend framework, laravel, symphony
working with us
active and challenging environment.
learn new technologies.
skill development.
improve your english skills.
friendly environment to work in.
flexible working hours.
benefits
salary is reviewed 2 times a year based on employee’s performance .
bonus based on staff performance.
company trip once a year.
private health insurance.
daily meal at excellent price
build a stable career with dynamic promotion and job opportunities.
requirements
student or bachelor’s degree in computer science or related field.
know to program in any programming language
good analytical skills
considered a plus
knowledge about database queries (mysql, oracle, postgres)
experience with various code versioning systems, such as subversion
knowledge of german language"
